{
  "schema_version": "1.0.0",
  "fixture_version": "RIV-FDE-1.0.0",
  "fixture_id": "ENG-RIV-FDE-001",
  "frozen_at": "2026-08-05T00:00:00Z",
  "synthetic_data_notice": "Entirely fictional teaching data. No real customer data, credentials, or secrets.",
  "organization": {
    "organization_id": "ORG-RIV-001",
    "name": "Riverside House",
    "industry": "fiction publishing",
    "description": "A fictional independent publisher with UK/EU and US imprints, confidential manuscripts, and mixed legacy systems.",
    "employee_count_claim": 184,
    "active_editor_count_claim": 72,
    "contract_editor_count_claim": 24,
    "evidence_class": "customer_claim"
  },
  "engagement": {
    "engagement_id": "ENG-RIV-FDE-001",
    "name": "Riverside Editorial Copilot Engagement",
    "stage": "pre-discovery",
    "sponsor_person_id": "PER-RIV-001",
    "delivery_lead_person_id": "PER-FDE-001",
    "primary_outcome": "Reduce time spent finding approved answers and preparing bounded manuscript continuations without weakening confidentiality, rights controls, or editorial accountability.",
    "provisional_launch_window": "2026-Q4",
    "evidence_class": "customer_claim"
  },
  "personas_and_stakeholders": [
    {
      "person_id": "PER-RIV-001",
      "name": "Maya Chen",
      "title": "Chief Operating Officer",
      "persona": "executive sponsor",
      "role_ids": ["ROLE-SPONSOR"],
      "tenant_ids": ["TEN-RIV-CORP"],
      "region_id": "REG-UKS",
      "goals": ["shorten manuscript cycle time", "show measurable adoption before the next catalog planning cycle"],
      "concerns": ["slow delivery", "unclear return on investment"],
      "decision_rights": ["engagement funding", "launch go or no-go"],
      "statement_ids": ["CON-RIV-001", "CON-RIV-004"]
    },
    {
      "person_id": "PER-RIV-002",
      "name": "Elena Marlow",
      "title": "Editorial Director",
      "persona": "business process owner",
      "role_ids": ["ROLE-EDITORIAL-DIRECTOR", "ROLE-EDITOR"],
      "tenant_ids": ["TEN-RIV-EU"],
      "region_id": "REG-UKS",
      "goals": ["find current house guidance quickly", "draft continuations that respect editor instructions"],
      "concerns": ["generic prose", "citations that do not support the answer", "extra clicks"],
      "decision_rights": ["editorial workflow acceptance", "editor cohort nomination"],
      "statement_ids": ["CON-RIV-002", "CON-RIV-003"]
    },
    {
      "person_id": "PER-RIV-003",
      "name": "Jon Bell",
      "title": "General Counsel",
      "persona": "legal and rights owner",
      "role_ids": ["ROLE-RIGHTS-COUNSEL"],
      "tenant_ids": ["TEN-RIV-CORP", "TEN-RIV-EU", "TEN-RIV-US"],
      "region_id": "REG-UKS",
      "goals": ["preserve rights restrictions", "retain evidence for contested decisions"],
      "concerns": ["cross-title leakage", "autonomous rights changes", "unclear deletion behavior"],
      "decision_rights": ["rights policy interpretation", "legal incident notification", "rights workflow approval"],
      "statement_ids": ["CON-RIV-003", "CON-RIV-006"]
    },
    {
      "person_id": "PER-RIV-004",
      "name": "Aisha Rahman",
      "title": "Head of Information Security",
      "persona": "security approver",
      "role_ids": ["ROLE-SECURITY"],
      "tenant_ids": ["TEN-RIV-CORP", "TEN-RIV-EU", "TEN-RIV-US"],
      "region_id": "REG-UKS",
      "goals": ["enforce least privilege", "prove tenant and regional isolation"],
      "concerns": ["public AI upload", "stale group membership", "content in telemetry"],
      "decision_rights": ["security gate", "isolation re-enablement", "exception approval"],
      "statement_ids": ["CON-RIV-005", "CON-RIV-007"]
    },
    {
      "person_id": "PER-RIV-005",
      "name": "Theo Grant",
      "title": "Enterprise Applications Manager",
      "persona": "integration and operations owner",
      "role_ids": ["ROLE-IT-OWNER", "ROLE-SUPPORT-L2"],
      "tenant_ids": ["TEN-RIV-CORP"],
      "region_id": "REG-UKS",
      "goals": ["minimize bespoke integrations", "receive an operable service"],
      "concerns": ["ERP API rate limits", "support burden", "unclear rollback ownership"],
      "decision_rights": ["integration scheduling", "customer L2 ownership acceptance"],
      "statement_ids": ["CON-RIV-008", "CON-RIV-010"]
    },
    {
      "person_id": "PER-RIV-006",
      "name": "Priya Nair",
      "title": "Finance Business Partner",
      "persona": "commercial approver",
      "role_ids": ["ROLE-FINANCE"],
      "tenant_ids": ["TEN-RIV-CORP"],
      "region_id": "REG-UKS",
      "goals": ["cap monthly spend", "attribute costs by imprint"],
      "concerns": ["unbounded hosted-model usage", "optimistic volume estimates"],
      "decision_rights": ["monthly budget", "commercial exception"],
      "statement_ids": ["CON-RIV-004", "CON-RIV-009"]
    },
    {
      "person_id": "PER-RIV-007",
      "name": "Daniel Ortiz",
      "title": "Senior Editor, Northbank US",
      "persona": "editor champion",
      "role_ids": ["ROLE-SENIOR-EDITOR", "ROLE-EDITOR"],
      "tenant_ids": ["TEN-RIV-US"],
      "region_id": "REG-EUS",
      "goals": ["reduce policy search time", "keep final editorial control"],
      "concerns": ["slow first token", "irrelevant UK guidance"],
      "decision_rights": ["US cohort acceptance feedback"],
      "statement_ids": ["CON-RIV-001", "CON-RIV-011"]
    },
    {
      "person_id": "PER-FDE-001",
      "name": "Alex Morgan",
      "title": "Forward Deployed Engineer",
      "persona": "delivery lead",
      "role_ids": ["ROLE-FDE"],
      "tenant_ids": ["TEN-RIV-SBX"],
      "region_id": "REG-UKS",
      "goals": ["turn unknowns into owned decisions", "deliver measurable and supportable scope"],
      "concerns": ["solution-first discovery", "unsupported production claims"],
      "decision_rights": ["delivery recommendation", "technical stop-ship recommendation"],
      "statement_ids": []
    }
  ],
  "ambiguous_brief": {
    "brief_id": "BRF-RIV-001",
    "received_from_person_id": "PER-RIV-001",
    "received_at": "2026-07-15T09:00:00Z",
    "verbatim": "Help editors find answers and continue manuscripts faster. It should feel instant, use everything we already have, and be ready for the autumn list. We cannot send unpublished work to a public AI service. Ideally it should update the workflow for them so nobody has another system to maintain.",
    "explicit_outcomes": ["faster answer finding", "faster bounded continuation drafting"],
    "implied_outcomes": ["workflow automation", "broad source access", "production launch in 2026-Q4"],
    "missing_items": [
      "accepted user and workflow scope",
      "metric definitions and slices",
      "authority boundaries for workflow updates",
      "approved deployment and model-hosting boundary",
      "regional failover behavior",
      "support coverage outside UK business hours",
      "data deletion and retention acceptance criteria"
    ],
    "evidence_class": "customer_claim"
  },
  "use_cases": [
    {
      "use_case_id": "UC-RIV-001",
      "name": "Cited policy answer",
      "actor_role_ids": ["ROLE-EDITOR", "ROLE-SENIOR-EDITOR"],
      "decision_boundary": "Assistant may answer only from authorized current sources and must cite supporting passages.",
      "human_action": "Editor decides whether to use the answer.",
      "priority": "must"
    },
    {
      "use_case_id": "UC-RIV-002",
      "name": "Bounded manuscript continuation",
      "actor_role_ids": ["ROLE-EDITOR", "ROLE-SENIOR-EDITOR"],
      "decision_boundary": "Assistant may draft against an explicitly selected manuscript but cannot save, publish, or distribute the draft.",
      "human_action": "Editor reviews and manually accepts or rejects text.",
      "priority": "must"
    },
    {
      "use_case_id": "UC-RIV-003",
      "name": "Workflow status proposal",
      "actor_role_ids": ["ROLE-EDITOR", "ROLE-EDITORIAL-DIRECTOR"],
      "decision_boundary": "Assistant may propose a status transition; a human must confirm any write.",
      "human_action": "Authorized editor confirms the exact transition payload.",
      "priority": "should"
    },
    {
      "use_case_id": "UC-RIV-004",
      "name": "Rights restriction lookup",
      "actor_role_ids": ["ROLE-RIGHTS-COUNSEL", "ROLE-EDITORIAL-DIRECTOR"],
      "decision_boundary": "Assistant may retrieve restrictions but may not grant rights, change contracts, or infer missing rights.",
      "human_action": "Rights counsel makes the legal decision.",
      "priority": "should"
    }
  ],
  "non_goals": [
    {
      "non_goal_id": "NG-RIV-001",
      "statement": "Autonomous publication or external distribution of generated manuscript text"
    },
    {
      "non_goal_id": "NG-RIV-002",
      "statement": "Autonomous changes to rights, contracts, royalty, payment, or supplier records"
    },
    {
      "non_goal_id": "NG-RIV-003",
      "statement": "Training on all Riverside content without title-level approval and provenance"
    },
    {
      "non_goal_id": "NG-RIV-004",
      "statement": "Replacing editors or making final editorial judgments"
    }
  ],
  "current_workflow": {
    "workflow_id": "WF-RIV-EDITORIAL-001",
    "name": "Find guidance and prepare a manuscript response",
    "evidence_class": "measured_baseline",
    "steps": [
      {
        "step_id": "WFSTEP-RIV-001",
        "sequence": 1,
        "owner_role_id": "ROLE-EDITOR",
        "action": "Receive an author or production question in email or the workflow queue.",
        "system_ids": ["SYS-EMAIL", "SYS-WORKFLOW"],
        "median_minutes": 2.0,
        "failure_modes": ["request lacks title ID", "priority is implicit"]
      },
      {
        "step_id": "WFSTEP-RIV-002",
        "sequence": 2,
        "owner_role_id": "ROLE-EDITOR",
        "action": "Search policy PDFs, shared folders, and prior email threads.",
        "system_ids": ["SYS-SHARE", "SYS-EMAIL"],
        "median_minutes": 18.0,